Working on the bleeding edge of exciting technology, you're afforded the opportunity to experiment with new tools and attempt radically different approaches than traditional software engineering affords. Every day with the Data Engineering team is different and each project presents its own set of new and exciting challenges. Things shift very quickly in our industry and we rely on the Data Engineering team to keep us ahead of the curve and moving in the right direction.
Here's what we want:
Problem Solver: You are curious and loves exploring multiple approaches to find the most efficient, scalable solution and solve a problem
Collaborative: You work well with other people
Passionate: A passion for Big Data and an interest in the latest trends and developments constantly researching new tools and data technologies
Self-starter: You are comfortable helping your team get things done
Here's what you'll be doing:
Design, implement, and maintain data pipelines for extraction, transformation, and loading of data from a wide variety of data sources to various data services
Identify, design, and implement system performance improvements
Identify, design, and implement internal process improvements
Automate manual processes and optimize data delivery
Useful skills/background: You may or may not tick off every box, and that's ok. Each person brings a different background and different skills. If you think you are a good match for what we are looking for tell us why, and tell us what you are doing to improve yourself and we'll see what we can do to help!
A degree in Computer Science/Engineering or related field
2-4 years of experience in a software engineering environment
Experience with SQL and NoSQL systems
Knowledge of Hadoop, Spark, Kafka or other equivalent technologies
Proficiency in some of the following languages: Scala, Java, Python, Bash
Experience with automated testing systems
Mentorship, collaboration, and communication skills
Knowledge of data modelling, data warehousing, ETL processes, and business intelligence reporting tools
Experience working with CI/CD, containerization, and virtualization tools such as Gitlab, Jenkins, Kubernetes, Docker
Experience with tools like Databricks, Snowflake or PowerBI

Why Join Us?
Bond Brand Loyalty is proud to be recognized as one of Canada’s Best Managed Companies.

We’re 400(ish) people working tirelessly together to make the world a more loyal place. You’ll be joining a hyper-talented team with a galaxy of skillsets ranging from research to creative to digital and beyond. You’ll have an excellent opportunity to grow, learn and make an impact as we tackle some of our client’s biggest business challenges.
If you’re looking to build your career, build your skills and build bonds apply today!
Bond Brand Loyalty welcomes and encourages applications from people with disabilities. Accommodations are available on request for candidates taking part in all aspects of the selection process.	2020-08-16T23:47:40.000Z	fd5da69e089b7f27	Mississauga, ON	Bond Brand Loyalty	https://ca.indeed.com/rc/clk?jk=fd5da69e089b7f27&fccid=9343039b36601ad2&vjs=3	Data Engineer
2020081682	Toronto, ON	Perpetua's mission is to give superpowers to anyone that sells online. At the moment, we help media agencies, brands, and Amazon sellers win on Amazon by analyzing large amounts of data and using AI to develop smart optimization algorithms that drive transformational sales growth.

As a Senior Data Engineer, you will be responsible for maintaining and evolving our data infrastructure to support the massive scale of data that we process to power our customers' ad campaigns. This includes advancing our data capabilities to both cut costs and increase performance, while maintaining data integrity and consistency. You will build scalable infrastructure and data pipelines to deliver a platform unparalleled in the advertising space using Google BigQuery, Looker, Airflow and Python (Django, Pandas, SciPy Stack).
What You'll Do
Interact with internal stakeholders to figure out how to make it easier for them to leverage Petabyte-scale data
Accelerate data-informed decision making to transform our product & engineering strategy
Be responsible for developing, maintaining and evolving the Data Platform
Considering technical tradeoffs and advancing our data capabilities
Being responsible for data consistency and integrity both for our internal tools and client APIs
Owning data accessibility and discovery across all parts of the company
Increasing performance of our data pipeline
Evolving our use of available tools and optimising current tools to optimise infrastructure costs
Work in a fast-paced, scaling start-up building software that is truly impactful
What You'll Have
Experience with workflow management tools like Airflow for moving and transforming data
Experience with data mapping, schema design, data structures and algorithms, data quality and integrity
You'll deeply know your datawarehouse from your datalake from your transactional database
Experience designing infrastructure to facilitate both availability and approachability of data to all users (internal and external)
Ability to source requirements from stakeholders and develop a vision for a data-driven company
Ability to build and performance tune complex database queries
Ability to solve problems in new and innovative ways
Self starter who takes initiative; owning a project from start to finish
The ability to communicate complex technical issues in a clear and concise manner
Flexibility to adjust to changing priorities, requirements, and schedules
Experience working in a fast-paced, agile environment
Company Benefits
Impactful work that will help lay the foundation for future projects
Meaningful equity at an early stage company
Ground floor opportunity
Paid-for meals
Unlimited snacks and drinks
Full benefits plus a health spending account
Top of the line technology to help you build your own workspace
Flexible time off policy
At Perpetua, we are dedicated to pursuing and hiring a diverse workforce with varied experiences, perspectives and opinions. We believe diversity helps our team perform better and enables us to build an outstanding product for our customers. We are an equal opportunity employer and are committed to work with applicants requesting accommodation at any stage of the hiring process.	Perpetua Labs	2020-08-16T23:47:40.000Z	Senior Data Engineer	https://ca.indeed.com/rc/clk?jk=9c4363e25aeb557b&fccid=b7254da6203c84b3&vjs=3	9c4363e25aeb557b
2020081683	https://ca.indeed.com/rc/clk?jk=e8f01b72a171ac29&fccid=6df7987324612088&vjs=3	2020-08-16T23:47:41.000Z	goeasy	If you are looking to join one of Canada’s fastest growing companies, goeasy Ltd. is the place for you! Recognized as one of Canada’s Most Admired Corporate Cultures, one of Canada’s Top 50 Fintech’s and one of North America’s Most Engaged Workplaces, we want the best and brightest to join our team.

We are a publicly traded company on the TSX with over 4000% shareholder return since 2001, goeasy operates two main business units. easyfinancial is our consumer lending business that offers secured and unsecured installment loans of up to $35,000 and easyhome is Canada’s largest merchandise lease-to-own company. It is our mission to provide everyday Canadians the chance for a better tomorrow, today by giving them access to the credit they need and by offering them a second chance when they have been turned down by banks and traditional lenders. With a retail network of nearly 400 locations across Canada and over 1900 employees, we are able to build lasting relationships with our customers as we help them rebuild their credit and graduate towards prime rates and a brighter financial future.

The Data Engineer on the Data Science and Business Insights team will build, integrate data from various resources, manage data in goeasy operational data store and enterprise data warehouse. This position will develop ETL (Extract, Transform and Load) with various tools on large datasets to ensure data is easily accessible, works smoothly, as well as maintain and expand the data warehouse for reporting and analysis. The Data Engineer will also work closely with the data architect on the design and architecture of our enterprise data warehouse.

Responsibilities:

Develop data set processes for data modeling, mining and production
Develop and maintain ETL processes using SSIS, Scripting and data replication technologies
Participate in development of datamarts for reports and data visualization solutions
Research opportunities for data acquisition and new uses for existing data
Integrate new data management technologies and software engineering tools into existing structures
Support the translation of business requirements for data acquisition/manipulation and provide detailed specifications that can be passed downstream for use
Develop detailed technical specifications and operational support documentation in collaboration with Business Systems Analysts, BI Engineers and Architects.
Identify and communicate technical problems, process and solutions
Create Ad-Hoc queries and reports as needed along with providing on-going analytical support for these requests
Assist in the collection and documentation of user’s requirements
Ensure that existing business processes dependent on the ODS/EDW are monitored and respond quickly to bug fixes, enhancement requests and production ETL related issues.
Dealing with the database users on a daily basis to ensure that problems are dealt with promptly and that appropriate fixes are made to resolve any problems.
Recommend ways to improve data reliability, efficiency and quality
Ensure systems meet business requirements and industry practices
Work effectively with the Business Intelligence and Data Solutions Architects, Data and BI Engineers to ensure that all approved development and deployment procedures are followed.

Qualifications:

Bachelor’s Degree in Computer Science, MIS, Computer Engineering or other Information Technology related degree
4+ years working with SQL Server or comparable relational database system
3+ years of extensive ETL development experience with SSIS and/or ADF
4+ years of experience troubleshooting within a Data Warehouse environment
Expert domain knowledge & experience in Data warehousing, encompassing data model design, dimensional modeling, naming conventions, cross-cutting concerns, common integration technologies, patterns & standards and emerging technologies.
Expert Knowledge of SQL skills to build, debug, and optimize (developing procedures, functions, SQL queries, etc.) and working with large data sets and to perform root cause analysis on internal and external data and processes to answer specific business questions and identify opportunities for improvement.
2+ years SQL Server Database administration experience
Cloud experience (Azure) is highly preferred
Exposure and experience with Python, R, Hadoop, Azure, other Big data and advanced analytics
Knowledge of AI and ML developments/solutions/implementations
Experience with multiple programming languages (PowerShell scripting, C#, others) with basic scripting skills.
High level of technical aptitude

Inclusion and Equal Opportunity Employment

goeasy is an equal opportunity employer. In addition, goeasy is committed to providing accommodations for applicants upon request at any stage of the recruitment process in accordance with all legislative requirements throughout Canada. Please let us know if you require an accommodation due to a disability during any aspect of the recruitment process and we will work with you to address your needs.

Additional Information:

All candidates considered for hire must successfully pass a criminal background check, credit check, and validation of their work experience to qualify for hire. We thank all interested applicants, however we will only be contacting those for interview who possess the skills and qualifications outlined above.

Why should you work for goeasy?

To learn more about our great company please click the links below:

PAID1234	Mississauga, ON	e8f01b72a171ac29	Data Engineer
2020081684	Sr. Data Engineer	https://ca.indeed.com/rc/clk?jk=035a5f23df595f6f&fccid=2ca7392810684c2b&vjs=3	This position will join our growing team of data and analytics experts for Cox Automotive Canada. You will be responsible for expanding and optimizing our data pipeline architecture, as well as optimizing data flow and collection for cross functional teams. You will support our data initiatives and will ensure optimal data delivery consistent throughout ongoing projects.

As a Senior Data Engineer, you will be responsible for leading Data Engineering projects throughout their entire lifecycle, that being: initial investigation and stakeholder engagement, solution design, application development, testing and sign-off, release and maintenance

The ideal candidate is an experienced data pipeline builder and data wrangler who enjoys optimizing data systems and building them from the ground up. They must be self-directed and comfortable supporting the data needs of Cox Automotive Canada. The right candidate will be excited by the prospect of optimizing or even re-designing our company’s data architecture to support our next generation of products and data initiatives, enabling the evolution of our Data Science and Business Intelligence

Responsibilities:
Assemble large, complex data sets that meet functional / non-functional business requirements.
Recommend different ways to constantly improve data reliability and quality
Identify, design, and implement internal process improvements: automating manual processes, optimizing data delivery, re-designing infrastructure for greater scalability, etc.
Improve upon the data ingestion pipelines, ETL jobs, and alarms to maintain data integrity and data availability.
Build analytics tools that utilize the data pipeline to provide actionable insights into customer acquisition, operational efficiency and other key business performance metrics
Performs other job-related duties as assigned or apparent and Stay up-to-date with advances in data persistence and big data technologies
Prototype and design new data integration solutions that balance security, scalability, fault-tolerance, performance as well as cost effectiveness
Define, document and champion best practice architectural patterns and work with wider technology development teams to proactively seek out new opportunities to utilise Data Solutions technology and data assets
Be responsible for leading the delivery of multiple Data Engineering development projects at a time. Project delivery responsibility extends from design, development, testing, release and maintenance
Be responsible for leading the delivery of multiple Data Engineering development projects at a time. Project delivery responsibility extends from design, development, testing, release and maintenance
Qualifications

Qualifications

3+ years’ technical experience working in Big Data, designing solutions to complex data ingestion problems
Graduate degree in Computer Science, Computer Engineering or a related field
Big Data Certification and AWS certification would be an asset
Must have strong Data Orchestration experience using tools such has AWS Step Functions, Lambda, AWS Data Pipeline, Apache Nifi.
Advance Python Skills to develop efficient, decouple Data pipeline
In-depth knowledge of AWS Big Data Services
Must possess in-depth knowledge and hands on development experience in building Distributed Big Data Solutions including ingestion, caching, processing, consumption, logging & monitoring)
Must have a strong understanding and experience with Cloud Storage infrastructure and operationalizing AWS based storage services & solutions prefer S3 or related specific business questions and identify opportunities for improvement
Experience in building processes supporting data transformation, data structures, metadata, dependency and workload management
A successful history of manipulating, processing and extracting value from large disconnected datasets
Working knowledge of message queuing, stream processing, and highly scalable data stores
Advanced working SQL knowledge and experience working with relational databases, query authoring (SQL) as well as working familiarity with a variety of databases
Experience supporting and working with cross-functional teams in a dynamic environment
Experience deploying data pipelines with CI/CD
Experience with Snowflake Data Warehouse is plus
Organization: Cox Automotive
Primary Location: Canada-Ontario-Mississauga-2233 Argentia Rd
Employee Status: Regular
Job Level: Individual Contributor
Shift: Day Job -
Travel: Yes, 5 % of the Time
Schedule: Full-time
Unposting Date: Ongoing	Cox Automotive	035a5f23df595f6f	Mississauga, ON	2020-08-16T23:47:42.000Z
2020081685	https://ca.indeed.com/rc/clk?jk=1f6d9f1ab7c60335&fccid=1c4aa3d5a92746d4&vjs=3	Mosaic North America	Senior Big Data Engineer	1f6d9f1ab7c60335	Mississauga, ON	The Senior Big Data Engineer DevOps role reports to the Director, Data Sciences DevOps. The role is part of the DevOps team in charge of the daily operations of various integration technologies. The role is responsible for supporting workloads running on the Hadoop environment and associated technologies. This position will be responsible for monitoring the batch jobs, resolving incidents, optimizing workloads, tuning jobs, and making job enhancements.

The role will focus on production support and will also take part in the DevOps rotation for making enhancements. Also, the role will be involved in R&D of emerging technologies with the application administrators and technical architects.

Strategic:
Evaluate tools and technologies in the context of the future state architecture, and evolving business requirements
Responsible for review of project artifacts during the transition phase and ensure operational needs are met
Research & development about new Hadoop & Analytical technologies
Review solution and technical designs
Propose best practices/standards
Benchmark the performance in line with the non-functional requirements
Previous experience in developing and deploying operational procedures, tuning guides and best practices documentation
Attention to detail to review project deliverables for completeness, quality, and compliance with established project standards

Candidate Profile:
3+ years developing and supporting applications leveraging the Hadoop stack
3+ of experience with data integration/ETL tools such as DataStage or alternatives
SDLC knowledge in both waterfall and agile methodologies
Hands-on experience with source code management system (SVN, Git) and continuous integration tools (Jenkins)
Experience on following tools: Hive, SQL, Spark, Kafka, Flume, Sqoop, HBase ,Pig, HDFS, R, NoSQL
Experience on handling data processing, delivering distributed and highly scalable application
Experience with HortonWorks Hadoop Distribution
Experience with large scale domain or enterprise solution analysis development, selection and implementation
Experience with high-volume, transaction processing software applications
Good understanding of workload management, schedulers, scalability and distributed platform architectures
Experience in software development and architecture experience using Java EE technologies (Application Server, Enterprise Service Bus, SOA, Messaging, Data Access Layers)
Experience in scripting languages & automation such as bash, PERL, and Python
Experience in data warehousing, analytics, and business intelligence/visualization/presentation
Experience using SQL against relational databases
Working knowledge of search technologies like Lucene, Solr
5+ years of hands-on experience on Linux, AIX, and z/OS
Professional Skill Requirements
Excellent communication skills (both written and oral) combined with strong interpersonal skills
Strong analytical skills and thought processes combined with the ability to be flexible and work analytically in a problem-solving environment
Attention to detail
Strong organizational & multi-tasking skills
DISCLAIMER:
Acosta/Mosaic North America is an Equal Opportunity Employer
The above statements are intended to describe the general nature and level of work being performed by people assigned to this classification. They are not intended to be construed as an exhaustive list of all responsibilities, duties, and skills required of personnel so classified. Mosaic reserves the right to modify all or part of any job descriptions at its discretion in order to meet and or exceed the needs of the business.
We are committed to providing accommodations for persons with disabilities. If you require accommodation, we will work with you to meet your needs, to the extent required by law.

Qualifications


Primary Location: CA-ON-Mississauga
Work Locations: Acosta-Mosaic Mississauga Corporate Office 2700 Matheson Blvd. E. W. Tower 2nd Floor Mississauga L4W 4V9
Job: Information Technology
Organization: CoE - Client Information Services - Canada
Shift: Standard
Job Type: Full-time
 Day Job
Job Posting: Aug 4, 2020, 10:54:13 AM	2020-08-16T23:47:42.000Z
2020081686	Toronto, ON	https://ca.indeed.com/pagead/clk?mo=r&ad=-6NYlbfkN0DQQnUBuQBSuyaIQhpC59TW7hrTbBg8v-nGtzzV8dunbQHh9VTp-k89gJ8q3B9UEXLHcYbAG67d8jpOK4E3ok8olcOhfyyiChWMI3BPvUFdra3ljwgLS_vFsJXlW6jHt2NpQMzd2p9F6BXGm9ND3feUN42yGy4tVXBU7xPsBm2zUk7nGBqHByUhHIV2H7K_Lr9L0nXq85_uwFRMuFXOo4YoYKLdPK9ppz1IHUAK1PwmPAneq_DUFIPE90uSm09_fKIVrmLxHYYzLuW3Z4fqILge0xev5eK6k3TbsMzDj6G91BxA0uWwQbkwUAb_YdtyxKQ-ctlh9N97m4nQup91JHQjxdV7uqhUtdOBfxaTv9EWHVkUbznbM54VWJIR6Eoxl9T-g-Maee9sUvdO-yovUjwekHw3aro4INJJzdivjulTttzpw_hLfOT0INdDo-VaWePPoMxtO_zKW11opggWuJFW5HyLX3yocwcp9hejXjhOjhoHIEqlej46-XYL8Z1BPXVLBmw1lfB19bztJPL041_fwk6pHo7XY3LjprolV6qPwMOwS1fDEcArFCI3Djkw6eeYbTBrbi-xJmJn8_3E3uOg52aX06npcTEK-YOLSH2LMy9BQUGrzTNZ40wrYea-0B0niyepyJ2JVow5PEB3LiGR1LrGHgDZAz23UINKXRlpKW3a408DeQtcX9jJda5lgSRpAqMEwzQ33UTkq6upr21pV551uuxBuH-cwwDrcIdkQeaPhYv55NBhbJpQhaZUELe044KiX2TBbnfIUcIEdhNBo2O-y_QDm9DyVZaQGsgF890JiJjtEpBJoLM4mEM0HxAAUZZP3sMKf1F2wXhM6SUMi3TJdFSXdrE=&p=10&fvj=0&vjs=3	TES - The Employment Solution	05f7bf2a7458c7fc	2020-08-16T23:47:43.000Z	Job Title- Data Engineer
Location- Downtown, Toronto
Type - Full Time Permanent
Salary - Negotiable + Benefits



Focus on data architecture, best practices, reliability, security, and complianceImprove and extend ETL, data processing, and analytics processesFacility with PowerBI, including creating dashboards and data sourcesDeveloping high complexity, fast performing SELECT queries.Developing T-SQL procedures, functions, triggers, jobs, scripts, etc.Development of Advanced T-SQL such as temporal tables, PIVOTs, recursive table expressions and more.Modeling and implementing Data Mart solution for Power BI analytics
Managing indexes, statistics, query plans alerts, database activity, and overall performance activity.In-depth experience working with relational databases, such as Microsoft SQL Server or PostgreSQLEnthusiasm for applying good data design, testing, documentation, and support practicesExperience building and optimizing data pipelines, architectures, and data setsKnowledge of message queueing, stream processing, and data stores/warehousesWorking knowledge of AWS products related to data engineeringBachelor's degree in Computer Science, Software Engineering or an equivalent
Excellent communication skills - both written and verbal; ability to speak in Spanish is a bonus

To apply please send an email to sheetalk@tes.net	Data Engineer
2020081687	https://ca.indeed.com/pagead/clk?mo=r&ad=-6NYlbfkN0DbNJQGwjC-NEA80-qlVyEGmSv34Xx0eW4t4u9rXSv_7_tlvMU2e-Gw_wrZ47s1zPCnrySU2yuEL07wtSyx7XOwYh5VPcVL7CxRhOYwHzR-CdmyBrwbeqommOn6y9FD_uKIYpUCb9-PC_XgwGzBDrPy7SD7JQndrQc_GJzDDokXuPiGIHKK0Gqlhv-QDHDcUsX9CwIWiGr9U1sa3ad6WJuDcf_XHYDAEw-czNIhUKEXhzyWzM4FDb6ErfDWnTn-E14WDJN9YEDr3yegTjZyu98x9BwPJthFdRJZELbvyAIMIEb5f2eHJe0DHgd69oluMyGXB7R7VEmqXPkW0jIKewS4cYp7h-uKlquw_ZMnwnuj4REQOeQXczRIzAtsc8U90TezviCt7Dk-OeDFygOeuShK1p3kI36PbGmkAZle7ufTuIZFxuvmg0yii6GdmFYFMf_ZX9tIwKg08PFn0LAGpU0t55hima2qCpYcSpzlqcOCmQ==&p=11&fvj=0&vjs=3	goeasy	If you are looking to join one of Canada’s fastest growing companies, goeasy Ltd. is the place for you! Recognized as one of Canada’s Most Admired Corporate Cultures, one of Canada’s Top 50 Fintech’s and one of North America’s Most Engaged Workplaces, we want the best and brightest to join our team.

We are a publicly traded company on the TSX with over 4000% shareholder return since 2001, goeasy operates two main business units. easyfinancial is our consumer lending business that offers secured and unsecured installment loans of up to $35,000 and easyhome is Canada’s largest merchandise lease-to-own company. It is our mission to provide everyday Canadians the chance for a better tomorrow, today by giving them access to the credit they need and by offering them a second chance when they have been turned down by banks and traditional lenders. With a retail network of nearly 400 locations across Canada and over 1900 employees, we are able to build lasting relationships with our customers as we help them rebuild their credit and graduate towards prime rates and a brighter financial future.

The Data Engineer on the Data Science and Business Insights team will build, integrate data from various resources, manage data in goeasy operational data store and enterprise data warehouse. This position will develop ETL (Extract, Transform and Load) with various tools on large datasets to ensure data is easily accessible, works smoothly, as well as maintain and expand the data warehouse for reporting and analysis. The Data Engineer will also work closely with the data architect on the design and architecture of our enterprise data warehouse.

Responsibilities:

