202008161	Toronto, ON	2020-08-16T23:46:34.000Z	The growing team here at Myticas is looking for an experienced Data Engineer who would be interested in a remote contract opportunity within the Ottawa, Toronto and Montreal regions.

Accountabilities:

Defining and reviewing security design requirements for cloud infrastructure and application components.
Evaluating architecture patterns from security perspective.
Building and implementing security controls to enable enforcement of compliance with Cloud Control Objectives, using custom Azure policies and integrated controls in DevOps processes

Requirements:

Strong Data Engineer w/ DevOps expertise + Azure Cloud Experience
Must know how to code and stand up scripts.
Experience with Data Digestions
Experience writing scripts to automate (infrastructure)
ARM Templating Expertise
Azure Synapse Expertise
Support developing automated DevOps processes and procedures for the following Azure components:
Azure Synapse (Azure DW) & Studio (private preview)
Azure Data Catalog Gen 2 (Babylon – private preview)
Azure Data Lake Storage Gen 2
Azure ML
ML Flow
Azure SQL Analysis Service
Azure Databricks
ADF data pipelines for data loading to AzSQL/Synapse
ADF data pipelines for connecting to on-prem data sources for data

Candidates looking to apply for this role are to send us an updated version of their resume in confidence. Our team will be sure to review all applicants and follow up accordingly at the conclusion of the review process.

Job is also known as: Data Engineer, DevOps Engineer, Azure Cloud Engineer, Azure Engineer, Cloud Engineer

INDMY	https://ca.indeed.com/pagead/clk?mo=r&ad=-6NYlbfkN0Bt274jo0r_e0cCCqhskoQvohXG3bfDAo8rIdE-Msu3yuVfyF2oiDFKHFOU-vxVulAfe8kPL7riFwoXa1bsfN-szjxO_8qUQWbPsJOnTg0EkutIoK2S4NNLL24JQh9e4DsE9hv907k2_zDbvj0a8WAj5oPSV5J0YhjbTRwBfRwjCQxrc01uZ7J2e0_OHMexeIZTG8YrQagugaJ_D3lIHrWlHcf6PJnH2k8UvA-pc5cZpjw7ddqytNa624y9NXPvrifnTOAT7FAmk3UeLDuUfX1-skYbziNYR4Y7c5p3OsyfnSCh07UWqitBDNEYM6p9cLI4DHIttyCqjWLFYfggBXnYYpSWqsionve4WjKW6yzGyfBSYg7v03a4FQXFEw5Ge855e7c6Un29ITzsnzvdKuEGvQO5IKk7vCwyMZdafaIYiLhT-PX9FM4pxDgT63Kt6e9eG7HuTZTHAA==&p=0&fvj=0&vjs=3	BHJOB15656_15145 - Data Engineer w/ DevOps - Azure Cloud	a32b7c599156a218	Myticas Consulting
202008162	Data Engineer (Intermediate 4-6 years) - Contract - Remote during COVID	https://ca.indeed.com/pagead/clk?mo=r&ad=-6NYlbfkN0Dkh866153otbRJ8nVMuEXnXPd315JS377__3VyD6HnNQkmcaOHMemmy5pLrNV6j0WaVWEWWabnp4PP6-2u77DLfT_FCIGvCW8CQmQW140Z7EVU32Jnwl42FALsxnbc4n5M6FOTfoW2OoTMOcGG21HZGOoXL7fWT8eaT67VlcClh4sHQcJsHCX_ihTEuHOc6UEzYYKVUb_jfygvE4ZvKl89B_GvxGLfO-e4Sjzx2m3ERv0ivnCOhgBcoB6iuW5gJOF67wyjAj6fnI5LNhBdZKlcNZr9gDWVp2CBrCJbFNa5TXaTjdfrwhPXDUebdRdjm-t23l_ayHtK7zEcrc_ULQNTq2n5ryptjnEOO6tblOw20JtnK10nBjyS14Uo0MzRkxgcjHnwx8EGDhwcGcfjoF2NpYj7tIDAPddz_vg7YOCiz_CRsgmdbM-bBpRW2KMYQJFoIXFDj_oo4RJGVd2lOj8ZtHlsJsOD1aygwi8tFB3b8uuV6ZcbgGM9&p=1&fvj=1&vjs=3	Role: Data Engineer (Intermediate 4-6 years)Structure: Contract (6 months initially)Location: North York, ONHours: Monday - Friday 40 hours (remote during COVID-19)Pay: $50.00 p/h inc.The role: We are looking for Intermediate Data Engineers who have roughly between 4-6 years experience who ideally has experience moving data from Google cloud over to Big query.However, if you are someone who has good experience with ETL and Data Pipeline Design & Data Validation experience and can script in Python and create strong SQL Queries then this will also be a potential match for this role.Ideal Qualifications to be successful in this role: - Degree in Computer Science, Engineering, Information Systems (or equivalent combination of skill and experience)- 4-6 years of experience working with data architecture projects- Excellent SQL coding and experience with a broad array of development tools and platforms including exposure to a big data environment tools/languages, such as SQL, R, SAS, Python, etc.- Experience creating relational database design and data models- Experience with various analytical data platforms and technologies- Experience with using REST API, Cloud (GCP Ideally)- Experience in custom or structured data integration design, implementation, and maintenance- Experience with business intelligence tools such as Qlikview, Tableau and Microstrategy (Nice to have for Data Visualizations)- Previous experience working in retail or eCommerce is highly preferred- Ability to curate data to tell stories and provide business insightsPlease apply with an updated resume and ensure the required skills you are able to speak to for this position are included.For more roles like this please go to www.corgta.com/find-a-job/Job Type: Full-timeSalary: $45.00-$50.00 per hour	CorGTA	2020-08-16T23:46:35.000Z	North York, ON	997673b8effa647f
202008163	Toronto, ON	TES - The Employment Solution	05f7bf2a7458c7fc	2020-08-16T23:46:35.000Z	https://ca.indeed.com/pagead/clk?mo=r&ad=-6NYlbfkN0DQQnUBuQBSuyaIQhpC59TW7hrTbBg8v-nGtzzV8dunbQHh9VTp-k89gJ8q3B9UEXLHcYbAG67d8jpOK4E3ok8olcOhfyyiChWMI3BPvUFdra3ljwgLS_vFsJXlW6jHt2NpQMzd2p9F6BXGm9ND3feUN42yGy4tVXDAHqnNfhnu70vY-acBciq67Ai6GdSD3PlQ13tg4qFrRiLpqIcz_-jDIa5Nq63B9wZ628cpPKY6dro-rYYuaRQsjRboGg5ghzntSbAnB9ZJ1QNRhNiUeaOyL7c2R4WqqvxXeA3YX0iHxxqG9n63eRdXvRlJQAPR3H3B0HskcFu92t8odPo8Qz2YfC_ifUv0n3nJs5aT9AHKgas7G2cM4YosR62pRkMoR-DKKJvwJo1sAis2WZlVzleg_3Al5gCGbP_iZj94awD8kZbyV4ZrXI89TOCG-iZhzVZ6HnByoD19pPqLYrcrPxpa47CX3Au24RjLYWrQuTMIWq_nR83byXNtb3eOKuxSO40Nn_nf4SwugQHe1fSMFFbDOIsZyH_GUp5MEGdYNtE9o4WkAxcXzvAtwfNyZN1whoXc9RPLNr7z5VFAy5J5LEjrBOL_9mHEecWAMM2Trsu7RlUK81Gz4_Oe3WkCO26f2t9jq8HU877w686HNDrNQ923RPg17weNBQY504sjGAq150H88GjkY40ZGtkWimoifDeV39XfTSJWDOJcaIHeaXc3c8-8p-fksONw-x2fILu8lbit4oXVdsxA95PrBiD3K8n0K34AGFtjE_1K5icfaXrUV_r6rVxXUMlPFsREmjAQCjp_wu1P9Ba_MjaDdtndXPATNQL5GIuAqOAV5RrcvdgM&p=2&fvj=0&vjs=3	Job Title- Data Engineer
Location- Downtown, Toronto
Type - Full Time Permanent
Salary - Negotiable + Benefits



Focus on data architecture, best practices, reliability, security, and complianceImprove and extend ETL, data processing, and analytics processesFacility with PowerBI, including creating dashboards and data sourcesDeveloping high complexity, fast performing SELECT queries.Developing T-SQL procedures, functions, triggers, jobs, scripts, etc.Development of Advanced T-SQL such as temporal tables, PIVOTs, recursive table expressions and more.Modeling and implementing Data Mart solution for Power BI analytics
Managing indexes, statistics, query plans alerts, database activity, and overall performance activity.In-depth experience working with relational databases, such as Microsoft SQL Server or PostgreSQLEnthusiasm for applying good data design, testing, documentation, and support practicesExperience building and optimizing data pipelines, architectures, and data setsKnowledge of message queueing, stream processing, and data stores/warehousesWorking knowledge of AWS products related to data engineeringBachelor's degree in Computer Science, Software Engineering or an equivalent
Excellent communication skills - both written and verbal; ability to speak in Spanish is a bonus

To apply please send an email to sheetalk@tes.net	Data Engineer
202008164	Toronto, ON	There is never a typical day at Accenture, but that’s why we love it here! This is an extraordinary chance to begin a rewarding career at Accenture Technology. Immersed in a digitally compassionate and innovation-led environment, here is where you can help top clients shift to the New using leading-edge technologies on the most ground-breaking projects imaginable.

Interested in building end-to-end marketing solutions for clients? Bring your talent and join Data which operates in the Interactive, Mobility and Analytics space. You will have opportunities to get involved in digital marketing, eCommerce and end-to-end mobility capabilities to help clients to improve productivity and more!

WORK YOU’LL DO
Work across the Service Delivery Lifecycle to analyze, design, build, test, implement and/or maintain multiple system components or applications for Accenture or our clients
Responsible for the maintenance, improvement, cleaning, and manipulation of data in the business’s operational and analytics databases
Support our database architects, data analysts and data scientists on data initiatives and will ensure optimal data delivery architecture is consistent throughout ongoing projects
Determines methods and procedures on new assignments with guidance
Manages small teams and/or work efforts (if in an individual contributor role) at a client or within Accenture

WHO WE´RE LOOKING FOR?
Minimum 5 years of experience as a Data Engineer
Must have experience with one of the Cloud Technologies (Azure or AWS)
Azure cloud includes Spark, Python, Databricks, Synapse, Snowflake, Data Factory and ADLS
AWS cloud includes Glue, EC2, EMR, Athena, redshift, Snowflake, S3, Spark, Python and Databricks
Experience with Big Data technologies like MapReduce, Pig, Hive, HBase, Sqoop, Flume, YARN, Kafka, Storm and etc.
2+ years of experience with at least one SQL language such as T-SQL or PL/SQL
2+ years of work experience with ETL and data modeling
Experience building and optimizing ‘big data’ data pipelines, architectures and data sets
Experience in both batch and stream processing technologies
Experience with object-oriented/object function scripting languages: Java, C++, Scala
Machine learning experience with Spark or similar
Professional Skills Qualifications:
Proven success in contributing to a team-oriented environment.
Proven ability to work creatively in a problem-solving environment.
Desire to work in an information systems environment.
Demonstrated teamwork and collaboration in professional setting; either military or civilian.
WHAT´S IN IT FOR YOU?
Competitive benefits, including a fair and balanced parental leave policy.
Fantastic opportunities to develop your career across industries with local and global clients.
Performance achievement and career mentorship: our performance management process focuses on your strengths, progress and career possibilities.
Opportunities to get involved in corporate citizenship initiatives, from volunteering to charity work.
To learn more about Accenture, and how you will be challenged and inspired from Day 1, please visit our website at accenture.ca/careers.
It is currently our objective to assign our people to work near where they live. However, given the nature of our business and our need to serve our clients, our employees must be available to travel when needed.

Accenture does not discriminate on the basis of race, religion, color, sex, age, non-disqualifying physical or mental disability, national origin, sexual orientation, gender identity or expression, or any other basis covered by local law. Accenture is committed to providing employment opportunities to current or former members of the armed forces.

We are committed to employment equity. We encourage all people, including women, visible minorities, persons with disabilities and persons of aboriginal descent to apply.

Accenture is a leading global professional services company, providing a broad range of services and solutions in strategy, consulting, digital, technology and operations. Combining unmatched experience and specialized skills across more than 40 industries and all business functions — underpinned by the world’s largest delivery network — Accenture works at the intersection of business and technology to help clients improve their performance and create sustainable value for their stakeholders. With 469,000 people serving clients in more than 120 countries, Accenture drives innovation to improve the way the world works and lives. Visit us at www.accenture.com	fbcc383eeed7b6dc	https://ca.indeed.com/rc/clk?jk=fbcc383eeed7b6dc&fccid=a4e4e2eaf26690c9&vjs=3	2020-08-16T23:46:36.000Z	Accenture	Data Engineer
202008165	Toronto, ON	2020-08-16T23:46:37.000Z	Data Engineer, GEMINI (Contract)	25f6a9d8e47d869e	Vector Institute	https://ca.indeed.com/rc/clk?jk=25f6a9d8e47d869e&fccid=1a9a6d236cf89e9e&vjs=3	POSITION OVERVIEW


The Vector Institute is seeking a Data Engineer, GEMINI to join our team in Toronto. This role will predominantly work with the General Medicine Inpatient Initiative (GEMINI) team at St. Michael’s Hospital, in addition to providing support to the Vector community.


The Data Engineer, GEMINI will primarily work in R to lead a team to automate and optimize GEMINI’s data pipeline workflow including extracting, transforming and loading data, conducting quality and validation checks, and standardizing data from multiple data sources. The ideal candidate will have excellent programming skills, a strong understanding of data pipelines and analytic methods, an aptitude for data visualization, and strong leadership and communication skills. You will be joining a dynamic and mission-driven team of clinicians, scientists, and quality improvement experts.
EMPLOYMENT TYPE


Contract (18 months)


ABOUT THE VECTOR INSTITUTE


A thriving, independent not-for-profit, the Vector Institute strives to advance the Artificial Intelligence ecosystem in Ontario, developing and attracting the world’s best machine learning and deep learning experts, and creating an unrivalled convergence of research, investment, entrepreneurialism, and economic growth. Located in the MaRS Discovery District in downtown Toronto, we are part of a dynamic and vibrant community of research, academia, health science and commerce.


ABOUT GEMINI


Co-led by Drs. Fahad Razak and Amol Verma, GEMINI has developed methods to extract and standardize data from electronic health records to harness the tremendous potential of data generated through routine patient care of General Internal Medicine hospital inpatients for research and quality improvement purposes. GEMINI is a unique data platform in the Canadian healthcare landscape and currently exists at 7 hospitals, with data collected on 345,000+ patient visits, including billions of data points. The GEMINI data platform has recently been funded to expand to the 30 largest hospitals in Ontario to support data analytics that inform the COVID-19 pandemic response. GEMINI supports a network of nearly 100 collaborating scientists and more than 40 students, including clinicians, computer scientists, biostatisticians, epidemiologists, social scientists, and engineers.
RESPONSIBILITIES


Develop scripts to extract, transform and load data from multiple data sources into GEMINI’s platform;

Gather requirements and conduct analyses to design, develop and maintain secure data pipelines;
Automate and optimize GEMINI’s data pipeline workflows;
Provide leadership and guidance to data pipeline team;
Maintain and update on-going quality assurance of data workflows;
Engages with team and collaborators to understand needs and requirements;
Documents data pipeline architecture;
Routinely tests and monitors system for failures, errors, breaches;
Troubleshoot problems;
Provides teaching and training as needed;
Create and update Standard Operating Procedures and other documentation files, as needed;
Establish methods to improve and automate data workflow of rapidly changing COVID-19-related data;
Support GEMINI’s data platform as required; and,
Perform other functions as required (e.g., providing scientific advice and support to other members Vector’s teams and corporate projects led by Vector).


SUCCESS MEASURES


GEMINI’s data pipeline workflow is automated and optimized through the development of algorithms and procedures.
High quality coding practices are maintained.
Significant contributions are made towards GEMINI’s data platform.


PROFILE OF IDEAL CANDIDATE


A degree in Engineering, Computer Science and/or related discipline; graduate degree preferred
At least 5 years’ relevant professional experience
Fully knowledgeable in designing and testing of data pipelines required
Extensive experience in SQL as well as at least one of either R or Python required
Familiarity of key databases such as: PostgreSQL, MySQL, Oracle, etc. is preferred
Knowledge of Linux commands and Shell scripts required
Strong analytical, technical design and problem-solving skills required
Strong working knowledge of Microsoft Office products (e.g. Outlook, Word, Excel, PowerPoint) required
Experience with GitHub preferred
Good judgement and understanding of what issues to escalate, resolve on your own, making suggestions for possible resolution required
Ability to learn new technology expediently required
Demonstrated success working within interdisciplinary teams
Experience with the Ontario healthcare system is an asset
Excellent attention to detail and proven ability to learn new skills
Experience working independently and as part of a team
Excellent organizational skills to manage multiple tasks in a timely manner
Demonstrated flexibility and have the ability to adapt and manage changing priorities


Please address applications (cover letter and resume) to Kailyn Burke, HR Generalist, using the link provided. Review of applications will begin August 19, 2020. We thank all applicants for their interest in this exciting opportunity and will be in touch with those whose qualifications most closely match with our needs. Please note that candidates may be required to demonstrate proficiency in R.

The Vector Institute is committed to employment equity and diversity in the workplace and welcomes applications from women, racialized persons/visible minorities, Indigenous peoples, persons with disabilities, and LGBTQ+ persons. All qualified candidates are encouraged to apply.


Further, we are committed to fostering an environment of inclusivity and accessibility. If you require an accommodation at any point throughout the recruitment and selection process, please

contact hr@vectorinstitute.ai and we will happily work with you to meet your needs.
202008166	Fluid Hose & Coupling	Junior Data Engineer	7cc1b932ac3ee1bf	Mississauga, ON	Job summaryResponsible for the completion of long-term IT engineering projects. Performs engineering design evaluations and works to complete projects within budget and scheduling restraints. Develops, implements, and monitors information systems policies and controls to ensure data accuracy, security, and regulatory compliance.Responsibilities· Responsible for the analysis, improvement, cleaning, and manipulation of legacy relational databases at the company.· Responsible for the architectural design and development of a modernized database, integrated with legacy systems.· Responsible for the full-stack development of web applications which enhance customer and employee relationships with company data.· Responsible for general development and maintenance of the company's IT systems, including web server maintenance and website updates.· Works with the business’s leadership team, in order to aid in the implementation of database requirements and troubleshoot any existent issues.· Defines and builds the data pipelines that will enable faster, better, data-informed decision-making within the business.· Manages Salesforce database base as required by sales leadershipEducation and Skill Requirement· Computer Programming degree or equivalent. Equivalence may be demonstrated from past projects, results, etc· Computer Programming/Cloud Computing/Data Science/Data Engineer/Database Management/IT Security and Infrastructure· Ability to learn new technologies unguided/with minimal intervention (Adaptability)· Complete knowledge of Web programming, design, e-commerce, SQL and relational DB Design. Understands data structures and hierarchies (1-2+ years of experience with SQL, or any other database management system)· Clear understanding of System Architecture and ERP systems· Detail oriented, organized with strong analytical and critical thinking skills· Excellent communication skills combined with patience in the process· Excellent Excel and MS Office skills with a deep understanding of Excel macros and programming. May be required to demonstrate this in a remote interview by example· Quick learner and familiar with CRUD Operations· Resourcefulness to keep moving forward (does not stall at a challenge)· Preference will be given to those who understand App design and machine learningJob Types: Full-time, PermanentSalary: $40,000.00-$40,001.00 per yearBenefits:Dental CareExtended Health CareOn-site ParkingSchedule:8 Hour ShiftMonday to FridayEducation:Bachelor's Degree (Required)Work remotely:No	2020-08-16T23:46:38.000Z	https://ca.indeed.com/company/FLUID-HOSE-&-COUPLING-INC/jobs/Junior-Data-Engineer-7cc1b932ac3ee1bf?fccid=5156f9b5283a3233&vjs=3
202008167	Toronto, ON	https://ca.indeed.com/rc/clk?jk=6e7b18ed4b257445&fccid=e981b35e4c0452a3&vjs=3	6e7b18ed4b257445	CI Investments Inc	2020-08-16T23:46:38.000Z	ABOUT US
CI Investments Inc. is one of the country’s largest investment fund companies. CI is known for its innovation and ability to adapt quickly to the changing needs of Canadian investors. It provides employees with a fast-paced and challenging work environment with opportunities for advancement. CI is part of CI Financial, a diverse group of financial services firms.
POSITION: Data Engineer
LOCATION: Toronto (M5J 0A3)
STATUS: Contract (6 months with extension possibility)
JOB OVERVIEW
We are currently seeking a Data Engineer to join our Client Reporting and Data Management team. The successful candidate will work closely with our data science team on the development of our centralized predictive analytics function. In this role, you will assist with solving high-value business problems by extracting and manipulating large, complex datasets for use by data scientists. The role will be a six-month contract position, with an option to extend based on performance.
WHAT YOU WILL DO
Collaborate with business analysts, data scientists, software engineers, and solution architects to develop data pipelines to feed our data marketplace
Extract, analyze & interpret large, complex datasets for use in predictive modelling
Utilize AWS tools to develop automated, productionized data pipelines
Identify, design, and implement internal process improvements: automating manual processes, optimizing data delivery, re-designing infrastructure for greater scalability, etc.
Develop and support ETL code for data warehouse and data marts to support the reporting and data analytic systems.
WHAT YOU WILL BRING
At least two years of work experience in quantitative analysis
Post-secondary degree in a quantitative discipline
Experience with large-scale, AWS big data storage such as S3 and EBS
Experience creating ETL jobs using AWS Glue or Talend
Experience with AWS Data pipeline tools like Cloudwatch and Stepfunctions
Experience working with data preparation tools like Talend
Experience in the Financial Services Industry is an asset
Strong knowledge with programming methodologies (version control, testing, QA) and agile development methodologies.
In-depth knowledge of AWS tools required to develop automated, productionized data pipelines
In depth knowledge of and experience with relational, SQL and NoSQL databases
Fluency with SQL and Python
Experience working with large, complex datasets
Excellent communication, writing and interpersonal skills
WHAT YOU CAN EXPECT FROM US
Our dedication to the Employee Experience at CI is aimed at supporting, empowering and inspiring our talented team through:
Recognition & Compensation
Training & Development
Health & Well-being
Communication & Feedback
If you are a passionate, committed and dynamic individual, please submit your resume in confidence by clicking “Apply”.
Only qualified candidates selected for an interview will be contacted.
CI Financial Corp. and all of our affiliates (“CI”) are committed to fair and accessible employment practices and we are committed to providing accommodations for persons with disabilities. If you require accommodations in order to apply for any job opportunities, or require this posting in an additional format, please contact us at accessible.recruitment@ci.com, or call 416-364-1145 ext. 4747. If you are contacted by CI regarding a job opportunity or testing and require accommodation in any stage of the recruitment process, please use the above contact information. We will work with all applicants to determine appropriate accommodation for individual accessibility needs.	Data Engineer
