The Data Engineer on the Data Science and Business Insights team will build, integrate data from various resources, manage data in goeasy operational data store and enterprise data warehouse. This position will develop ETL (Extract, Transform and Load) with various tools on large datasets to ensure data is easily accessible, works smoothly, as well as maintain and expand the data warehouse for reporting and analysis. The Data Engineer will also work closely with the data architect on the design and architecture of our enterprise data warehouse.

Responsibilities:

Develop data set processes for data modeling, mining and production
Develop and maintain ETL processes using SSIS, Scripting and data replication technologies
Participate in development of datamarts for reports and data visualization solutions
Research opportunities for data acquisition and new uses for existing data
Integrate new data management technologies and software engineering tools into existing structures
Support the translation of business requirements for data acquisition/manipulation and provide detailed specifications that can be passed downstream for use
Develop detailed technical specifications and operational support documentation in collaboration with Business Systems Analysts, BI Engineers and Architects.
Identify and communicate technical problems, process and solutions
Create Ad-Hoc queries and reports as needed along with providing on-going analytical support for these requests
Assist in the collection and documentation of user’s requirements
Ensure that existing business processes dependent on the ODS/EDW are monitored and respond quickly to bug fixes, enhancement requests and production ETL related issues.
Dealing with the database users on a daily basis to ensure that problems are dealt with promptly and that appropriate fixes are made to resolve any problems.
Recommend ways to improve data reliability, efficiency and quality
Ensure systems meet business requirements and industry practices
Work effectively with the Business Intelligence and Data Solutions Architects, Data and BI Engineers to ensure that all approved development and deployment procedures are followed.

Qualifications:

Bachelor’s Degree in Computer Science, MIS, Computer Engineering or other Information Technology related degree
4+ years working with SQL Server or comparable relational database system
3+ years of extensive ETL development experience with SSIS and/or ADF
4+ years of experience troubleshooting within a Data Warehouse environment
Expert domain knowledge & experience in Data warehousing, encompassing data model design, dimensional modeling, naming conventions, cross-cutting concerns, common integration technologies, patterns & standards and emerging technologies.
Expert Knowledge of SQL skills to build, debug, and optimize (developing procedures, functions, SQL queries, etc.) and working with large data sets and to perform root cause analysis on internal and external data and processes to answer specific business questions and identify opportunities for improvement.
2+ years SQL Server Database administration experience
Cloud experience (Azure) is highly preferred
Exposure and experience with Python, R, Hadoop, Azure, other Big data and advanced analytics
Knowledge of AI and ML developments/solutions/implementations
Experience with multiple programming languages (PowerShell scripting, C#, others) with basic scripting skills.
High level of technical aptitude

Inclusion and Equal Opportunity Employment

goeasy is an equal opportunity employer. In addition, goeasy is committed to providing accommodations for applicants upon request at any stage of the recruitment process in accordance with all legislative requirements throughout Canada. Please let us know if you require an accommodation due to a disability during any aspect of the recruitment process and we will work with you to address your needs.

Additional Information:

All candidates considered for hire must successfully pass a criminal background check, credit check, and validation of their work experience to qualify for hire. We thank all interested applicants, however we will only be contacting those for interview who possess the skills and qualifications outlined above.

Why should you work for goeasy?

To learn more about our great company please click the links below:

PAID1234	Mississauga, ON	e8f01b72a171ac29	2020-08-16T23:47:18.000Z	Data Engineer
2020081659	Toronto, ON	Our client, a boutique-size consulting firm, prides itself on being at the forefront of innovation in the Big Data space. Founded in 2010, they provide thought leadership and implementation excellence within the ever-growing data and analytics world.
They take pride in having some of the most highly trained and experienced consultants in the industry which translates into optimal value for their clients. They were one of the first companies to provide analytics and data as a service, via the cloud, as early as 2010. They strive to make sure their customers are well-positioned with the best technologies/tools in the industry, constantly evaluating new and existing technology partnerships. Some of the more prominent companies they have partnered with include; Snowflake, DataRobot, MicroStrategy, Informatica, Amazon AWS & Microsoft. They continue to invest in their most valuable resource, their people. They do this through extensive training both on the job and through various educational programs.
Due to growth, they are seeking to hire an Intermediate - Senior Integration Consultant.

Desired Skills and Experience
: University/College degree in Computer Science, Mathematics, Data Science and/or Relevant Degree
: 5+ years hands-on development, configuration, scripting and administration experience with Data Integration platforms. (i.e. Informatica, Talend, DataStage, SSIS)
: BI Experience (MicroStrategy, Looker, Tableau, PowerBI) considered a nice to have
: Extensive theoretical and practical knowledge of data warehousing principles/concepts and practical development experience in all areas of the data warehousing life cycle
: Experience with Data Management, ETL, Cloud Data (AWS), Data Integration
: Knowledge of OLAP-related principles and concepts
: Strong grasp of data modeling techniques and concepts (Normalized/Denormalized, Conceptual/Logical/Physical, Star, Snowflake, Data Vault)
: Strong knowledge and experience with relational databases such as Snowflake, SQL Server, Oracle (Advanced knowledge of reading and writing SQL, Performance analysis and tuning)
: Knowledge and experience with key Big Data technologies (Hive, Presto, Spark, Kafka, NoSQL databases, Semi-structured data access patterns (Json, Parquet, XML, etc.))
: Strong Python scripting skills
: Excellent communication skills
: Great problem-solving skills
: Leadership and good client management skills

Day to Day Activities Would Include
: Conduct relevant customer interviews to determine key business requirements and objectives
: Build appropriate analytical data models based on outcomes of user interviews
: Analyze and profile data systems to build source to target data mappings
: Review ETL performance and conducts performance tuning as required on mappings/workflows or SQL
: Administration and support of data integration infrastructure
: 2nd level on-call support of ETL services as required

You will be responsible for attaining the following goals:
: Attaining a minimum of 1 new accreditation/certification per year
: Spending 80% or more of their time on billable work
: Completing 90% or more of their agile delivery tasks on time
: Demonstrating competency in 1 new relevant technology every year	Copperstone Connect	https://ca.indeed.com/pagead/clk?mo=r&ad=-6NYlbfkN0Ceb7pqR8iGmLuXIZQklF6pqed3xddONNM6Jjumj-ndyGK0kULQUmQ2REqfJ5KAzFVeK_es1WVg0s1sLgKW09UsvVRp0-dSizFQr1oNyK_VIqdjla00VU9GNVvu2x4v9p3hsL7NeF-6hBksbAaSgKazsaYTODGMKQQeVuYcxoOuxvFKuD0HRLD9ybgbcXTn1LPcIBgaQpBqWRQZ_wf-2qO_PHwFuWetEceyIfFWYJqfiYFFEJq4afeRQE-ZPngeEIqOCon0mP249Q9CgwJSJrHhE2awYP7vW-Hj-ngNZ2zcxLc0SYO18gomkM5k-M6fLdj5nOGtGMFXhSXxWWvDyknJJxrcivLEiZEKM5Ick7Zo_XrZkqgg9JmwNzlI_6wUzsJAOt_8wS7ZN5S9rEC07D9jYzJEFgPb1xyRojUfJDgxk9KHy1rrBO9oRKKpG5LZZmEIU-oL-yq4FgwgVtBm7Axsn4Eu-aPPSxfxadUAt8YMZox2joU-mYBGgyXaSo51DP-TeBtlJxkyoGQnNRzR5sIwdt2uEuM_YNv9kwUIWNrobhnh5u58C6iL6taXYz7axOLkyzbCbIGdOJ31Dr_eyuNGojUyOHDlkDxGhQGqsSj0SKOfCmY6ms5U9oZNZZdg8vCifiFjAqFCA1BLyAEwpS9WvTgiziK63dVnik1eUzbw3A==&p=13&fvj=0&vjs=3	54e0fcc38385e3a2	Data Engineer/Integration Consultant	2020-08-16T23:47:19.000Z
2020081660	Toronto, ON	https://ca.indeed.com/pagead/clk?mo=r&ad=-6NYlbfkN0Bt274jo0r_e0cCCqhskoQvohXG3bfDAo8rIdE-Msu3yuVfyF2oiDFKHFOU-vxVulAfe8kPL7riFwoXa1bsfN-szjxO_8qUQWbPsJOnTg0EkutIoK2S4NNLL24JQh9e4DsE9hv907k2_zDbvj0a8WAj5oPSV5J0YhgrbSF1z_nzlGMUEWiJK22Y3v81Khv9agmdEzA0TpAkg25iJg5G3Q3FXk-7F9a5Qm8GgVEAirJv3ihdMIZPyPeGhD0eqLCdaGx5eXHG9wUlV8wUhxinHznptNemxNTNYBN6Dl-iwEGqonj_NWTbBRAv1fpdDvmSdkKwgiQ9yPpBUwCDixAns3FO6JnUa11cjUmKgk3tPrW55-2_FJMyw8J1hUGUShqyZEb_FALFcAQUEFQGGAsV2GgG2m3fWOXVIc3qHUe2beu5ApA_sWniryO5m2g0wu3xRHkmBeqqTkY9qQ==&p=14&fvj=0&vjs=3	2020-08-16T23:47:20.000Z	The growing team here at Myticas is looking for an experienced Data Engineer who would be interested in a remote contract opportunity within the Ottawa, Toronto and Montreal regions.

Accountabilities:

Defining and reviewing security design requirements for cloud infrastructure and application components.
Evaluating architecture patterns from security perspective.
Building and implementing security controls to enable enforcement of compliance with Cloud Control Objectives, using custom Azure policies and integrated controls in DevOps processes

Requirements:

Strong Data Engineer w/ DevOps expertise + Azure Cloud Experience
Must know how to code and stand up scripts.
Experience with Data Digestions
Experience writing scripts to automate (infrastructure)
ARM Templating Expertise
Azure Synapse Expertise
Support developing automated DevOps processes and procedures for the following Azure components:
Azure Synapse (Azure DW) & Studio (private preview)
Azure Data Catalog Gen 2 (Babylon – private preview)
Azure Data Lake Storage Gen 2
Azure ML
ML Flow
Azure SQL Analysis Service
Azure Databricks
ADF data pipelines for data loading to AzSQL/Synapse
ADF data pipelines for connecting to on-prem data sources for data

Candidates looking to apply for this role are to send us an updated version of their resume in confidence. Our team will be sure to review all applicants and follow up accordingly at the conclusion of the review process.

Job is also known as: Data Engineer, DevOps Engineer, Azure Cloud Engineer, Azure Engineer, Cloud Engineer

INDMY	BHJOB15656_15145 - Data Engineer w/ DevOps - Azure Cloud	a32b7c599156a218	Myticas Consulting
2020081661	Job Field:
Information Technology
Job Type:
Full-time
Building Location:
Length of Assignment:

SUMMARY

The Senior Data Engineer is a deep technical expert in building complex data warehousing and business intelligence applications. At this level, the incumbent demonstrates a passion and in-depth knowledge of large, complex application development methodologies. They motivate themselves and the team to refine their skills and adopt best practices for developing pragmatic software solutions for the organization. Leading the charge, they continue to raise the bar on mastery of business intelligence application development within the team and the organization.

KEY DUTIES & RESPONSIBILITIES

Programming

Uses in-depth knowledge of advanced programming techniques, design patterns and hardware/software interfaces to develop business intelligence and data warehouse applications.
Designs, tests and integrates data warehouse and BI modules and resolves programming errors using various debugging tools and techniques.
Provides guidance/mentors on programming practices and techniques to individuals and cross-functional teams.
Provides support, guidance and production assurance for very complex or urgent problems.
Performs work with minimum supervision, and work is assigned in terms of technical objectives.
Prepares technical documentation (e.g., user guides, technical specifications).
Assists in the design of business solutions.

Analysis

Conducts impact analysis for proposed changes to or problems across the system.
Leads team discussions in the analysis and collaboration to clarify and improve specifications or to identify alternative programming solutions.

Continuous Improvement

Makes recommendations or decisions on architecture, application design, standards and process improvements.
Enforces team and organizational standards and practices (e.g. at walkthroughs and peer code reviews).
Engages in continuous learning by developing and executing on a learning plan.
Takes responsibility for individual and the team's results.
Advocates for quality in all aspects of development efforts based on the team's definition of quality.

Risk Management

Estimates and prioritizes work to maximize value while taking into account risk, effort and dependencies.
Raises impediments, risks, and issues as early as possible and work with the team to mitigate as needed.

KNOWLEDGE & SKILLS

University graduation and minimum 5-10 years of relevant experience
Demonstrates in-depth knowledge of Microsoft BI architecture, established data warehouse development methodologies, multi-dimensional data modelling, OLAP, metadata management, data security, predictive analysis and big data processing. Extensive experience in one of these cloud data warehouses (Snowflake, bigtable, Redshift), Data Vault 2.0 methodology, steaming data processing, BI components in SQL Server 2016+, TSQL, and DAX, Power BI.
A good working knowledge of application security, C#, python, PowerShell, metadata management, NoSQL, and data security.
Experience in programming and debugging complex data warehouse and BI applications as part of a multi-disciplinary team environment (following an agile framework such as SCRUM preferred) based on Microsoft Team Foundation Server and git.
Experience in writing unit tests to support production code using a unit test framework.
Experience with database management (i.e. database design, schema creation, concurrency and performance considerations).
Takes ownership and initiative and collaborates well with a team of peers.
Demonstrates a commitment to continuous learning (e.g. user groups, blogs, conferences, community awareness, and next generation tooling).
Able to clearly communicate in both a verbal and written form within a predominantly English working environment.
Has a positive, passionate, idea generating attitude when faced with challenges.

Licenses and/or Professional Accreditation

Certification in Microsoft technologies preferred	bcb75a8b3d33578b	Markham, ON	Senior Data Engineer	2020-08-16T23:47:21.000Z	https://ca.indeed.com/rc/clk?jk=bcb75a8b3d33578b&fccid=84c23fbcabc14d59&vjs=3	BGIS
2020081662	At Bond, we design creative and innovative solutions for our clients, all with the goal of helping them build ever-stronger loyalty to their brands. That can take us in some pretty amazing directions, and as a Data Engineer, you’ll have your hands on the wheel as we drive the future of loyalty.

Working on the bleeding edge of exciting technology, you're afforded the opportunity to experiment with new tools and attempt radically different approaches than traditional software engineering affords. Every day with the Data Engineering team is different and each project presents its own set of new and exciting challenges. Things shift very quickly in our industry and we rely on the Data Engineering team to keep us ahead of the curve and moving in the right direction.
Here's what we want:
Problem Solver: You are curious and loves exploring multiple approaches to find the most efficient, scalable solution and solve a problem
Collaborative: You work well with other people
Passionate: A passion for Big Data and an interest in the latest trends and developments constantly researching new tools and data technologies
Self-starter: You are comfortable helping your team get things done
Here's what you'll be doing:
Design, implement, and maintain data pipelines for extraction, transformation, and loading of data from a wide variety of data sources to various data services
Identify, design, and implement system performance improvements
Identify, design, and implement internal process improvements
Automate manual processes and optimize data delivery
Useful skills/background: You may or may not tick off every box, and that's ok. Each person brings a different background and different skills. If you think you are a good match for what we are looking for tell us why, and tell us what you are doing to improve yourself and we'll see what we can do to help!
A degree in Computer Science/Engineering or related field
2-4 years of experience in a software engineering environment
Experience with SQL and NoSQL systems
Knowledge of Hadoop, Spark, Kafka or other equivalent technologies
Proficiency in some of the following languages: Scala, Java, Python, Bash
Experience with automated testing systems
Mentorship, collaboration, and communication skills
Knowledge of data modelling, data warehousing, ETL processes, and business intelligence reporting tools
Experience working with CI/CD, containerization, and virtualization tools such as Gitlab, Jenkins, Kubernetes, Docker
Experience with tools like Databricks, Snowflake or PowerBI

Why Join Us?
Bond Brand Loyalty is proud to be recognized as one of Canada’s Best Managed Companies.

We’re 400(ish) people working tirelessly together to make the world a more loyal place. You’ll be joining a hyper-talented team with a galaxy of skillsets ranging from research to creative to digital and beyond. You’ll have an excellent opportunity to grow, learn and make an impact as we tackle some of our client’s biggest business challenges.
If you’re looking to build your career, build your skills and build bonds apply today!
Bond Brand Loyalty welcomes and encourages applications from people with disabilities. Accommodations are available on request for candidates taking part in all aspects of the selection process.	2020-08-16T23:47:22.000Z	fd5da69e089b7f27	Mississauga, ON	Bond Brand Loyalty	https://ca.indeed.com/rc/clk?jk=fd5da69e089b7f27&fccid=9343039b36601ad2&vjs=3	Data Engineer
2020081663	Toronto, ON	Perpetua's mission is to give superpowers to anyone that sells online. At the moment, we help media agencies, brands, and Amazon sellers win on Amazon by analyzing large amounts of data and using AI to develop smart optimization algorithms that drive transformational sales growth.

As a Senior Data Engineer, you will be responsible for maintaining and evolving our data infrastructure to support the massive scale of data that we process to power our customers' ad campaigns. This includes advancing our data capabilities to both cut costs and increase performance, while maintaining data integrity and consistency. You will build scalable infrastructure and data pipelines to deliver a platform unparalleled in the advertising space using Google BigQuery, Looker, Airflow and Python (Django, Pandas, SciPy Stack).
What You'll Do
Interact with internal stakeholders to figure out how to make it easier for them to leverage Petabyte-scale data
Accelerate data-informed decision making to transform our product & engineering strategy
Be responsible for developing, maintaining and evolving the Data Platform
Considering technical tradeoffs and advancing our data capabilities
Being responsible for data consistency and integrity both for our internal tools and client APIs
Owning data accessibility and discovery across all parts of the company
Increasing performance of our data pipeline
Evolving our use of available tools and optimising current tools to optimise infrastructure costs
Work in a fast-paced, scaling start-up building software that is truly impactful
What You'll Have
Experience with workflow management tools like Airflow for moving and transforming data
Experience with data mapping, schema design, data structures and algorithms, data quality and integrity
You'll deeply know your datawarehouse from your datalake from your transactional database
Experience designing infrastructure to facilitate both availability and approachability of data to all users (internal and external)
Ability to source requirements from stakeholders and develop a vision for a data-driven company
Ability to build and performance tune complex database queries
Ability to solve problems in new and innovative ways
Self starter who takes initiative; owning a project from start to finish
The ability to communicate complex technical issues in a clear and concise manner
Flexibility to adjust to changing priorities, requirements, and schedules
Experience working in a fast-paced, agile environment
Company Benefits
Impactful work that will help lay the foundation for future projects
Meaningful equity at an early stage company
Ground floor opportunity
Paid-for meals
Unlimited snacks and drinks
Full benefits plus a health spending account
Top of the line technology to help you build your own workspace
Flexible time off policy
At Perpetua, we are dedicated to pursuing and hiring a diverse workforce with varied experiences, perspectives and opinions. We believe diversity helps our team perform better and enables us to build an outstanding product for our customers. We are an equal opportunity employer and are committed to work with applicants requesting accommodation at any stage of the hiring process.	Perpetua Labs	2020-08-16T23:47:23.000Z	Senior Data Engineer	https://ca.indeed.com/rc/clk?jk=9c4363e25aeb557b&fccid=b7254da6203c84b3&vjs=3	9c4363e25aeb557b
2020081664	Sr. Data Engineer	https://ca.indeed.com/rc/clk?jk=035a5f23df595f6f&fccid=2ca7392810684c2b&vjs=3	This position will join our growing team of data and analytics experts for Cox Automotive Canada. You will be responsible for expanding and optimizing our data pipeline architecture, as well as optimizing data flow and collection for cross functional teams. You will support our data initiatives and will ensure optimal data delivery consistent throughout ongoing projects.

As a Senior Data Engineer, you will be responsible for leading Data Engineering projects throughout their entire lifecycle, that being: initial investigation and stakeholder engagement, solution design, application development, testing and sign-off, release and maintenance

The ideal candidate is an experienced data pipeline builder and data wrangler who enjoys optimizing data systems and building them from the ground up. They must be self-directed and comfortable supporting the data needs of Cox Automotive Canada. The right candidate will be excited by the prospect of optimizing or even re-designing our company’s data architecture to support our next generation of products and data initiatives, enabling the evolution of our Data Science and Business Intelligence

Responsibilities:
Assemble large, complex data sets that meet functional / non-functional business requirements.
Recommend different ways to constantly improve data reliability and quality
Identify, design, and implement internal process improvements: automating manual processes, optimizing data delivery, re-designing infrastructure for greater scalability, etc.
Improve upon the data ingestion pipelines, ETL jobs, and alarms to maintain data integrity and data availability.
Build analytics tools that utilize the data pipeline to provide actionable insights into customer acquisition, operational efficiency and other key business performance metrics
Performs other job-related duties as assigned or apparent and Stay up-to-date with advances in data persistence and big data technologies
Prototype and design new data integration solutions that balance security, scalability, fault-tolerance, performance as well as cost effectiveness
Define, document and champion best practice architectural patterns and work with wider technology development teams to proactively seek out new opportunities to utilise Data Solutions technology and data assets
Be responsible for leading the delivery of multiple Data Engineering development projects at a time. Project delivery responsibility extends from design, development, testing, release and maintenance
Be responsible for leading the delivery of multiple Data Engineering development projects at a time. Project delivery responsibility extends from design, development, testing, release and maintenance
Qualifications

Qualifications

3+ years’ technical experience working in Big Data, designing solutions to complex data ingestion problems
Graduate degree in Computer Science, Computer Engineering or a related field
Big Data Certification and AWS certification would be an asset
Must have strong Data Orchestration experience using tools such has AWS Step Functions, Lambda, AWS Data Pipeline, Apache Nifi.
Advance Python Skills to develop efficient, decouple Data pipeline
In-depth knowledge of AWS Big Data Services
Must possess in-depth knowledge and hands on development experience in building Distributed Big Data Solutions including ingestion, caching, processing, consumption, logging & monitoring)
Must have a strong understanding and experience with Cloud Storage infrastructure and operationalizing AWS based storage services & solutions prefer S3 or related specific business questions and identify opportunities for improvement
Experience in building processes supporting data transformation, data structures, metadata, dependency and workload management
A successful history of manipulating, processing and extracting value from large disconnected datasets
Working knowledge of message queuing, stream processing, and highly scalable data stores
