They take pride in having some of the most highly trained and experienced consultants in the industry which translates into optimal value for their clients. They were one of the first companies to provide analytics and data as a service, via the cloud, as early as 2010. They strive to make sure their customers are well-positioned with the best technologies/tools in the industry, constantly evaluating new and existing technology partnerships. Some of the more prominent companies they have partnered with include; Snowflake, DataRobot, MicroStrategy, Informatica, Amazon AWS & Microsoft. They continue to invest in their most valuable resource, their people. They do this through extensive training both on the job and through various educational programs.
Due to growth, they are seeking to hire an Intermediate - Senior Integration Consultant.

Desired Skills and Experience
: University/College degree in Computer Science, Mathematics, Data Science and/or Relevant Degree
: 5+ years hands-on development, configuration, scripting and administration experience with Data Integration platforms. (i.e. Informatica, Talend, DataStage, SSIS)
: BI Experience (MicroStrategy, Looker, Tableau, PowerBI) considered a nice to have
: Extensive theoretical and practical knowledge of data warehousing principles/concepts and practical development experience in all areas of the data warehousing life cycle
: Experience with Data Management, ETL, Cloud Data (AWS), Data Integration
: Knowledge of OLAP-related principles and concepts
: Strong grasp of data modeling techniques and concepts (Normalized/Denormalized, Conceptual/Logical/Physical, Star, Snowflake, Data Vault)
: Strong knowledge and experience with relational databases such as Snowflake, SQL Server, Oracle (Advanced knowledge of reading and writing SQL, Performance analysis and tuning)
: Knowledge and experience with key Big Data technologies (Hive, Presto, Spark, Kafka, NoSQL databases, Semi-structured data access patterns (Json, Parquet, XML, etc.))
: Strong Python scripting skills
: Excellent communication skills
: Great problem-solving skills
: Leadership and good client management skills

Day to Day Activities Would Include
: Conduct relevant customer interviews to determine key business requirements and objectives
: Build appropriate analytical data models based on outcomes of user interviews
: Analyze and profile data systems to build source to target data mappings
: Review ETL performance and conducts performance tuning as required on mappings/workflows or SQL
: Administration and support of data integration infrastructure
: 2nd level on-call support of ETL services as required

You will be responsible for attaining the following goals:
: Attaining a minimum of 1 new accreditation/certification per year
: Spending 80% or more of their time on billable work
: Completing 90% or more of their agile delivery tasks on time
: Demonstrating competency in 1 new relevant technology every year	Copperstone Connect	https://ca.indeed.com/pagead/clk?mo=r&ad=-6NYlbfkN0Ceb7pqR8iGmLuXIZQklF6pqed3xddONNM6Jjumj-ndyGK0kULQUmQ2REqfJ5KAzFVeK_es1WVg0s1sLgKW09UsvVRp0-dSizFQr1oNyK_VIqdjla00VU9GNVvu2x4v9p3hsL7NeF-6hBksbAaSgKazsaYTODGMKQQeVuYcxoOuxvFKuD0HRLD9ybgbcXTn1LOg85A399nevZh7QIe94JtI5oxmQkH7vIOgfxBBCL751qXORBmJrpeycAXoZgzLTAQwwkLIsuUVCRmzoi-UDqE-qAvaXLCJTXMPClX1iBLMdvJZwnRoufyn9KbRrPODAynzGHydlLcySeUh8csUPkp3B-yCy0yGHrDwbDHYM7fgJ9a6Grk8Ieu_5g54G_mT-AvG48EaOclOA5gxNDXS1KZyTycay4bcrCwYYQ_bsYFUpJxZLCisnXHQ4_fyooC8nvqu2otyieONXC3p273mp7CqeOmlcKnkPW1CsE1qAVIgpzUm1ikS4pXn04X0Cm40gdL6cVMBrlkKydzY2eew7V-ktfyfiP_YgN5Y2BcICs3X9RxHte7gE8D0e1xJEq7_9LH2gmoP9UWhDPQMJJD1qB0SUCsc7iYTXgFmuhsBe-gZ9IGhWcrBjEctvzi3n8EsQ-1OPdweAFziO5jYzm2ykA13CqGBIPNa0GraxwaU1Raijw==&p=14&fvj=0&vjs=3	54e0fcc38385e3a2	Data Engineer/Integration Consultant	2020-08-16T23:46:56.000Z
2020081631	Toronto, ON	https://ca.indeed.com/pagead/clk?mo=r&ad=-6NYlbfkN0Bt274jo0r_e0cCCqhskoQvohXG3bfDAo8rIdE-Msu3yuVfyF2oiDFKHFOU-vxVulAfe8kPL7riFwoXa1bsfN-szjxO_8qUQWbPsJOnTg0EkutIoK2S4NNLL24JQh9e4DsE9hv907k2_zDbvj0a8WAj5oPSV5J0YhgrbSF1z_nzlOcOgBACdtIuenuiJ1Ue15k8DtZnSseghatiSG5kqdAO5hbT33VXvB8ypB3dS2Mij4Hx1OIC0C-BEysLJ-oim3mFsu-cQDNyBGQRmtv7qkaSCM-Sk7MGuYbPkYtX15yFtsCHM0N6Taxe2B_DwwKZvw5hxg3hTXBQpBkh-N0WTikbviBqX66CK6WeZw-6wi7fasdfTTK8CqdX--yGhUxo_MWjDCWAD6T4cRyjFq3CPJAOfl4bnzzaSdWqeWVUtT-attTgSWon5WTin7IZnKGbe1MpoR3L4Mu5nA==&p=0&fvj=0&vjs=3	The growing team here at Myticas is looking for an experienced Data Engineer who would be interested in a remote contract opportunity within the Ottawa, Toronto and Montreal regions.

Accountabilities:

Defining and reviewing security design requirements for cloud infrastructure and application components.
Evaluating architecture patterns from security perspective.
Building and implementing security controls to enable enforcement of compliance with Cloud Control Objectives, using custom Azure policies and integrated controls in DevOps processes

Requirements:

Strong Data Engineer w/ DevOps expertise + Azure Cloud Experience
Must know how to code and stand up scripts.
Experience with Data Digestions
Experience writing scripts to automate (infrastructure)
ARM Templating Expertise
Azure Synapse Expertise
Support developing automated DevOps processes and procedures for the following Azure components:
Azure Synapse (Azure DW) & Studio (private preview)
Azure Data Catalog Gen 2 (Babylon – private preview)
Azure Data Lake Storage Gen 2
Azure ML
ML Flow
Azure SQL Analysis Service
Azure Databricks
ADF data pipelines for data loading to AzSQL/Synapse
ADF data pipelines for connecting to on-prem data sources for data

Candidates looking to apply for this role are to send us an updated version of their resume in confidence. Our team will be sure to review all applicants and follow up accordingly at the conclusion of the review process.

Job is also known as: Data Engineer, DevOps Engineer, Azure Cloud Engineer, Azure Engineer, Cloud Engineer

INDMY	BHJOB15656_15145 - Data Engineer w/ DevOps - Azure Cloud	a32b7c599156a218	Myticas Consulting	2020-08-16T23:46:57.000Z
2020081632	Toronto, ON	TES - The Employment Solution	05f7bf2a7458c7fc	2020-08-16T23:46:58.000Z	Job Title- Data Engineer
Location- Downtown, Toronto
Type - Full Time Permanent
Salary - Negotiable + Benefits



Focus on data architecture, best practices, reliability, security, and complianceImprove and extend ETL, data processing, and analytics processesFacility with PowerBI, including creating dashboards and data sourcesDeveloping high complexity, fast performing SELECT queries.Developing T-SQL procedures, functions, triggers, jobs, scripts, etc.Development of Advanced T-SQL such as temporal tables, PIVOTs, recursive table expressions and more.Modeling and implementing Data Mart solution for Power BI analytics
Managing indexes, statistics, query plans alerts, database activity, and overall performance activity.In-depth experience working with relational databases, such as Microsoft SQL Server or PostgreSQLEnthusiasm for applying good data design, testing, documentation, and support practicesExperience building and optimizing data pipelines, architectures, and data setsKnowledge of message queueing, stream processing, and data stores/warehousesWorking knowledge of AWS products related to data engineeringBachelor's degree in Computer Science, Software Engineering or an equivalent
Excellent communication skills - both written and verbal; ability to speak in Spanish is a bonus

To apply please send an email to sheetalk@tes.net	https://ca.indeed.com/pagead/clk?mo=r&ad=-6NYlbfkN0DQQnUBuQBSuyaIQhpC59TW7hrTbBg8v-nGtzzV8dunbQHh9VTp-k89gJ8q3B9UEXLHcYbAG67d8jpOK4E3ok8olcOhfyyiChWMI3BPvUFdra3ljwgLS_vFsJXlW6jHt2NpQMzd2p9F6BXGm9ND3feUN42yGy4tVXBU7xPsBm2zUh2tjgNyKT1VASrQOaDE7JhcaMidbT1VuvIHfjygFzAQGBKfaVEZRoI4j6gAhyFlwUG1GsJjYGWKsXmuG0sYLFVX0pwkZGJLwtnXGwEitrKsEcmGNhvEVrVvE0WQJLHK4APV5rbO8EZSo0OLqM-CLOX4CP-aicgC6H4xHYDGDU1roRjZE2gqN-SPz94nDqrTXTABwBebm4LqdMrX0z0vYIvvf99wv17T29_PrmQFgYHpZTK6TlttGP8CxvVgdHQls48pIe_vlo55v6oxeFfIltymkTPbtA7onKmWAYJFYtKfVWLs9yLEXUi5pXtyUlNnXxcyJCJh_hjfEybMR3e1GZvok2kgrUqtK2ncksRholR7bn6XrAcNCqX0SM4G7GBkp4Rxm9JhzAV1HjBKXb6ekTWMiAbR_N6vxRcfsTkg_pNcXgFFwJ6NOB9sWlp3rToR6erMBRIqbk8IZgdgqHooNhxkX2X7qhLK-O8B9daFImqdcN6qSBDhIgI2F6bHtZA_F-j9YM38DDbkotl94UgkiuYy2nmuQ3uqApJHEu0nPhI3SSf_LXs3BV0x5q6VJZkJ1rCaMayXtYAaO-IxrjOE2ZhhHSZS8DDx5DjiIRYL5_lNpj54ffyxM5GqCqnB82jOsPRJ8Tjw_WoFt5mpzVg4Um4Fj1v6_Jd1rLFPMKEOYK9GlwiAEGwQGoY=&p=1&fvj=0&vjs=3	Data Engineer
2020081633	Toronto, ON	Data/Software Engineer Co-op	67bbfacf7e5a2ca0	https://ca.indeed.com/rc/clk?jk=67bbfacf7e5a2ca0&fccid=e4a22b3d28be02c0&vjs=3	The Company

Smart Nora is a wellness tech company based in Toronto that has improved sleep and relationships for tens of thousands of couples around the world. Our debut product is the world's most comfortable snoring solution and has been listed on Oprah’s Favorite Things, as well as Good Morning America, TIME, TODAY and BBC to name a few.

The Team

We are an ambitious, tight-knit team with an open work environment and a self-directed approach. We typically work out of our office at King+Spadina or remotely in a weekly cadence of Monday kick-offs, Wednesday tea times, and Friday wrap-ups — taking a lot of pride in our individual work and holding one another accountable for producing great work.

Note: Currently we are all working from home throughout the COVID-19 pandemic.

The Product

Smart Nora is an over-the-counter, contact-free snoring solution relevant to the 40% of adults who snore. Smart Nora is loved by customers for its comfortable contact-free design that enables users to sleep without any attachments to their face or body.

The Role

We are looking for a Software / Data Engineer. This is a co-op placement, full-time from September - December ideally for a 4th-5th year student. We are flexible with an earlier starting date or longer term.

Location

Remote

What you would do

Support the current FW project conducted with our third party project partners by implementing structured testing and documentation
Build supporting tools in Python, Node, or other scripting languages to validate firmware and hardware
Actively participate in Mobile App development project with our third party project partners
Support acoustic performance optimization including microphone and codec gain settings, assisted by automated tests
Be part of the Product team developing the next generation Smart Nora device
Wrangle data and decipher meaning from quantitative tests and analytics
Write clear documentation

Our requirements

Comprehensive understanding of Software Development processes (SDLC)
Comprehensive understanding of Object Oriented Programming (OOP) principles
Experience with Pandas, R, Tableau, or other data processing/visualization tools
Experience with GitHub (send us your profile!)
Exposure to cloud (AWS) and APIs is a plus
Experience in audio processing is a plus
Experience in machine learning is a plus
Majoring in Software Engineering, Computer Science, Industrial & Systems Engineering, or related field.

How to Apply

Please apply using our online application form to include your resume and links to your LinkedIn, GitHub (if have), and Kaggle (if have) profiles.

Accommodations are available on request for candidates throughout the application process. Please let us know your needs so that we may accommodate. Email careers@smartnora.com if you would like to discuss this role before applying.	Smart Nora	2020-08-16T23:46:59.000Z
2020081634	Toronto, ON	Company Description

Square builds common business tools in unconventional ways so more people can start, run, and grow their businesses. When Square started, it was difficult and expensive (or just plain impossible) for some businesses to take credit cards. Square made credit card payments possible for all by turning a mobile phone into a credit card reader. Since then Square has been building an entire business toolkit of both hardware and software products including Square Capital, Square Terminal, Square Payroll, and more. We’re working to find new and better ways to help businesses succeed on their own terms—and we’re looking for people like you to help shape tomorrow at Square.

Job Description

Square began with a simple yet revolutionary piece of hardware—the Square Reader. We have expanded that vision to give our merchants access to the latest secure payment technologies (contactless and chip cards) and easy-to-use Point of Sale products. Today our hardware carries over $30 billion in transactions annually. Measuring the performance of our hardware, and the journey in getting the hardware to our merchants, is essential in ensuring that our merchants’ experience with Square is as seamless as possible.
We need your help to collect data about our hardware, organize that data, and make it available to analysts across Square. As a member of the Hardware data engineering team, you will define, develop, and manage a variety of data infrastructure components and pipelines so that our analytics teams and collaborators have trusted data to inform decisions and insights.
You will:
Join the small but mighty Hardware data engineering team that partners with internal Hardware data consumers to understand their needs and to source the right data sets to work on
Work in a remote environment that allows you to build scalable Hardware data pipelines and tools to ingest data from internal/external sources to our cloud data stack (Snowflake / AWS)
Develop data structures to support flexible analysis of this data, including creating data models, structuring optimized ETLs, designing validation scripts
Troubleshoot technical issues with platforms, data discrepancies, alerts, etc.
Be a voice between the Hardware team and Square’s data community. Help the hardware team’s data producers embrace best-practices, represent the hardware team’s voice in data infrastructure planning discussions.
Report into a data engineering manager on the Platform Infrastructure Engineering team

Qualifications

You have:
3+ years building and supporting reporting data systems built on columnar oriented RDBMS systems (e.g. Snowflake, BigQuery, Redshift, Vertica, etc.)
Strong experience building data pipelines from heterogeneous data sources (e.g. Event streams, Flat Files, RDBMS, REST APIs, SFTP, etc.) to support real-time operational and analytical workloads
Technical accomplishments working with SQL, ETL, and Apache Airflow; and knowledge of at least one mature programming language (Ruby (and Rails), Python, Java, Go, or similar)
Experience with Linux/OSX command line, version control software (git), and general software development
Experience with cloud based data tools and services (e.g. AWS Lambda/S3/Transfer, GCP Cloud Functions/GCS, Fivetran, etc.)
Additional Information

At Square, our purpose is to empower – within and outside of our walls. In order to build the best tools for the businesses and customers we support all over the world, we have to start at home with a workforce as diverse and empowered as our sellers. To this end, we take great care to evaluate all employees and job applicants equally, based on merit, competence, and qualifications. We do not discriminate on the basis of race, religion, color, national origin, gender, sexual orientation, age, marital status, veteran status, disability status, or any other characteristic protected by law. We encourage candidates from all backgrounds to apply. Applicants in need of special assistance or accommodation during the interview process or in accessing our website may contact us by sending an email to assistance(at)squareup.com. We will treat your request as confidentially as possible. In your email, please include your name and preferred method of contact, and we will respond as soon as possible.

Perks

At Square, we want you to be well and thrive. Our global benefits package includes:

Healthcare coverage
Retirement Plans
Employee Stock Purchase Program
Wellness perks
Paid parental leave
Flexible time off
Learning and Development resources	9b3e8aaf625b3563	Data Engineer - Hardware	https://ca.indeed.com/rc/clk?jk=9b3e8aaf625b3563&fccid=09abad886b83c501&vjs=3	Square	2020-08-16T23:47:00.000Z
2020081635	Toronto, ON	2020-08-16T23:47:01.000Z	https://ca.indeed.com/rc/clk?jk=02c0e1b67825ddaf&fccid=0b1a3a8f9692c945&vjs=3	02c0e1b67825ddaf	About KOHO
KOHO is a quickly scaling FinTech company backed by leading investors and advisors from around the world. We started KOHO because we believe in doing two things:

Democratizing access to the best financial products and giving everyone a great financial foundation.

Since our journey began 5 years ago, we’ve raised more the $60M, grown the KOHO Collective to over 100 employees and created accounts for more than 250,000 Canadians.

About the Role
As our newest Data Engineer, you would bring your database design sense and meticulous standards for clean data to the table. More than just understanding the strategic importance of data in a financial context, you’re eager to roll up your sleeves and build the infrastructure to support it. We value potential as much as we value experience, so if you think you’d be a great fit we’d love to hear from you.
Responsibilities
Maintaining clean and consistent access to all our data sources
Providing a solid foundation for calculating key business metrics
Maintaining data infrastructure to keep up with the product roadmap
Understanding data lineage and governance for a variety of data sources
Communicating updates and changes to the broader data team as well as contributing to and maintaining data-related documentation
Desired Skills & Experience
Minimum of three years of experience working with data
Able to design efficient and scalable cloud architectures
Experience writing complex SQL Queries
Knowledge of ETL patterns, including testing and maintenance
Familiar with relational / non-relational database approaches and knowing which to apply where and when
Understanding of hot/warm/cold data concepts and when each is appropriate
Understanding of event-driven and stream-based processing patterns
Ability to think holistically about uses of data, designing for ease of data access
Working knowledge of one of Python, Java
Experience with Kubernetes cluster management is an asset
Experience with data processing frameworks such as Apache Spark
Nice-to-Have Skills
Experience with Google Cloud Platform (BigQuery, Dataflow, PubSub)
Knowledge of GoLang
Joining the (lovely!) KOHO Team

We invest time and resources into making sure KOHO is as good as the people we hire. Our culture is one of collaboration, creativity, and diverse perspective. Here are some of the reasons we attract the best people:
Balance Your Life - Unlimited PTO, generous vacation, flexible WFH, and a lifestyle spending accountLevel Up - Access to an onsite certified performance coachReach Your Goals - Salary assessments twice a year, annual training allowanceThe KOHO Culture - We have won 5 "Great Place to Work ®" awards since 2019

The Fine Print

We are an equal opportunity employer and value diversity and uniqueness at our company.

KOHO is trusted with highly sensitive information. Upon joining the team, you may be asked to undergo security screening including a criminal record check.	Koho	Data Engineer
2020081636	Toronto, ON	https://ca.indeed.com/rc/clk?jk=ad526aacc6864e5d&fccid=1747adf6142beb48&vjs=3	2020-08-16T23:47:02.000Z	Data Engineer - Infosphere MDM	Are you looking for unlimited opportunities to develop and succeed? With work that challenges and makes a difference, within a flexible and supportive environment, we can help our customers achieve their dreams and aspirations.
Job Description
Are you looking for unlimited opportunities to develop and succeed? With work that challenges and makes a difference and a flexible and supportive environment, we can help our customers achieve their dreams and aspirations. We are currently seeking a Data Engineer to join one of our fast growing teams.
A day to day breakdown of the role would be as follows: 60% Hands On Development and Analysis, 20% Business partner interaction, 20% Agile Team Collaboration.
Additional responsibilities include:
Designs and implements data architectures in production environments
You will develop solutions that process data real-time from a variety of sources and make data available to multiple partners ranging from other IT applications to business teams to end customers.
You will work jointly with the Front-End team to ensure the definition of API endpoints is well understood and their requirements are supported
Translates business needs into data architecture solutions
Develops data landscape modernization architectures and roadmaps
Review and analyze the effectiveness and efficiency of existing systems and develop strategies for improving or further utilizing these systems.
Creates, reviews, updates and presents systems models, specifications, diagrams and charts to provide direction to system programmers and manages third party vendor (managed services) relationships.
Develops standards and processes for coding, deployment, testing, and governance.
You would be a good for this this role if:
You work jointly with the Front-End team to ensure the definition of API endpoints is well understood and their requirements are supported
You value collaborative development, this can be read in the quality and readability of your code and in your thorough code reviews
You are obsessed with accurate, reliable customer data
You think about QA and testability before you implement anything
You are mindful your work doesn’t stop when something works on your local computer: you work collaboratively with DevOps, think about migration, deployment, test coverage and documentation
You are promoting a culture of self-serve data analytics by minimizing technical barriers to data access and understanding
Qualifications for this role include:
BSc in Computer Science, Statistics, Informatics, Information System, Mathematics or equivalent quantitative field preferred
Well versed in software development methodologies, testing, release management, and maintenance. take pride in optimizing and cleaning code, and leave a program in a better shape than you found it
Advanced working SQL knowledge and experience working with relational databases, query authoring (SQL). A SQL veteran,
Good understanding of Master Data Management and IBM InfoSphere.
Good knowledge of DevOps and CI practices, ability to spec and setup the right environments and deployment procedures, proficiency with Docker and Jenkins.
Excellent troubleshooting skills. Experience performing root cause analysis on internal and external data and processes to answer specific business questions and find opportunities for improvement.
Strong analytic skills related to working with unstructured datasets.
Understanding of relational and warehousing database technology working with at least one of the major databases platforms, preferably DB2, SQL Server
Practical experience with big data processing frameworks and techniques such as Azure, Hortonworks, Spark, Hive, PCF,
Solid working knowledge of data processing tools using SQL, Spark, Python or similar open source and commercial technologies
Knowledge of Java/Scala especially in relation to big data open source software preferred.
ETL experience is a requirement.
Agile project methodologies
Collaborative attitude, willingness to work with team members; able to coach, participate in code reviews, share skills and methods
Constantly learns from both success and failure
Good organizational and problem-solving abilities that enable you to manage through creative abrasion
Good verbal and written communication; effectively articulates technical vision, possibilities, and outcomes
Experiments with emerging technologies and understanding how they will impact what comes next.
What about Perks?
Manulife has lots of perks including, but not limited to:
Competitive compensation
Retirement Savings Accounts including a RPP (Pension Plan), RRSP (Retirement Savings Plan), and TFSA (Tax Free Savings account)
Manulife Share Ownership Program with employer matching
Customizable Benefits Package including Health, Dental, Vision, and 100% of Mental Health expenses
Financial support for ongoing training, learning, and education
Monthly Innovation Days (Hackathons)
Wearing jeans to work every day
An abundance of career paths and opportunities to advance
This is a full-time permanent role located in Toronto, Ontario.
We are an equal opportunity employer and value diversity at our company. We do not discriminate on the basis of race, religion, color, national origin, gender, sexual orientation, age, marital status, veteran status, or disability status

If you are ready to unleash your potential it’s time to start your career with Manulife/John Hancock.
About Manulife
Manulife Financial Corporation is a leading international financial services group that helps people make their decisions easier and lives better. With our global headquarters in Toronto, Canada, we operate as Manulife across our offices in Canada, Asia, and Europe, and primarily as John Hancock in the United States. We provide financial advice, insurance, and wealth and asset management solutions for individuals, groups and institutions. At the end of 2019, we had more than 35,000 employees, over 98,000 agents, and thousands of distribution partners, serving almost 30 million customers. As of March 31, 2020, we had $1.2 trillion (US$0.8 trillion) in assets under management and administration, and in the previous 12 months we made $30.4 billion in payments to our customers. Our principal operations are in Asia, Canada and the United States where we have served customers for more than 155 years. We trade as 'MFC' on the Toronto, New York, and the Philippine stock exchanges and under '945' in Hong Kong.
